{
  "time_budget": "6h",
  "difficulty_level": "beginner",
  "must_have": [
    "",
    ""
  ],
  "nice_to_have": [
    "",
    ""
  ],
  "wont_do": [
    "",
    ""
  ],
  "resource_limits": {
    "devices": {
      "has_pico_board": false,
      "has_sensors": false
    },
    "data": {
      "can_use_internet": true,
      "dataset_ready": false
    }
  },
  "safety_rules": {
    "hardware": [
      "不允许接入未知电源",
      "避免短路",
      "先做DeviceCheck再接线"
    ]
  }
}